{ "subject": { "type": "user", "id": "usr_01J8Z3Q4R5S6T7V8W9X0Y1Z2A3" }, "network_user_id": 7, "revision": 9, "username": "alex_new", "display_name": "Alex", "avatar_url": "https://openvibe.media/avatar/alex_new", "profile_color": null, "role": "streamer", "banned": true, "changed": ["username", "banned"] }
